{
  "silver_schema_version": "1.0",
  "article_id": "502f1b3bbce8badb8d7887613abb3c9af69d2f9c5365f39662b2a66ce25cb671",
  "source_url": "http://vietstock.vn/2026/08/thi-truong-chung-quyen-ngay-19082026-su-bi-quan-van-con-1636-1482208.htm",
  "domain": "vietstock.vn",
  "content_sha256": "0c6fc3a60ccd7834b9c6651348970bd12bd284ace692f6b5cdfbdbfb9a82f27e",
  "cleaned_text": "Thị trường chứng quyền ngày 19/08/2026: Sự bi quan vẫn còn\n26 phút trước\n18-08-2026 20:00:00+07:00\nThị trường chứng quyền ngày 19/08/2026: Sự bi quan vẫn còn\nKết thúc phiên giao dịch ngày 18/08/2026, toàn thị trường có 64 mã tăng, 197 mã giảm và 80 mã tham chiếu. Khối ngoại tiếp tục bán ròng với tổng mức bán ròng đạt 771.86 triệu đồng.\nI. DIỄN BIẾN THỊ TRƯỜNG CHỨNG QUYỀN\nKết thúc phiên giao dịch ngày 18/08/2026, toàn thị trường có 64 mã tăng, 197 mã giảm và 80 mã tham chiếu.\nĐộ rộng thị trường trong 20 phiên gần nhất. Đvt: Phần trăm\nTrong phiên giao dịch ngày 18/08/2026, bên bán tiếp tục dẫn dắt thị trường khiến phần lớn các mã chững quyền giảm giá. Cụ thể, các mã chứng quyền lớn trong nhóm giảm giá là CVHM2607, CVNM2615, CVHM2603, CMWG2525 và CVNM2610.\nNguồn: VietstockFinance\nKhối lượng giao dịch toàn thị trường trong phiên 18/08 đạt 56.46 triệu CW, giảm 7.47%; giá trị giao dịch đạt 36.76 tỷ đồng, tăng 1.97% so với phiên 17/08. Trong đó, CTCB2610 là mã dẫn đầu thị trường về khối lượng với 2 triệu CW; CVPB2617 dẫn đầu về giá trị giao dịch với 1.46 tỷ đồng.\nKhối ngoại tiếp tục bán ròng trong phiên 18/08 với tổng mức bán ròng đạt 771.86 triệu đồng. Trong đó, CACB2608 và CLPB2604 là hai mã bị bán ròng nhiều nhất.\nCông ty chứng khoán VND, KAFI, HCM, SSI và ACBS hiện đang là các tổ chức phát hành có nhiều mã chứng quyền nhất thị trường.\nNguồn: VietstockFinance\nII. THỐNG KÊ THỊ TRƯỜNG\nNguồn: VietstockFinance\nIII. THỐNG KÊ CÁC CHỨNG QUYỀN NỔI BẬT\nDựa trên phương pháp định giá chứng quyền Black-Scholes với thời điểm khởi đầu là ngày 19/08/2026, số liệu thống kê của 10 chứng quyền dẫn đầu về thanh khoản (giá trị và khối lượng khớp lệnh) trong phiên thuộc nhóm các chứng quyền vốn hóa lớn, được thể hiện như sau:\nNguồn: VietstockFinance\nLưu ý: Chi phí cơ hội trong mô hình định giá được điều chỉnh để phù hợp với thị trường Việt Nam. Cụ thể, lãi suất tín phiếu phi rủi ro (tín phiếu Chính Phủ) sẽ được thay thế bằng lãi suất tiền gửi trung bình của các ngân hàng lớn với sự hiệu chỉnh kỳ hạn phù hợp với từng loại chứng quyền.\nNhững mã chứng quyền có effective gearing càng cao thì biến động tăng/giảm theo chứng khoán cơ sở sẽ càng lớn. Hiện CSTB2532 và CVNM2610 là hai mã chứng quyền có tỷ lệ effective gearing cao nhất thị trường.\nCác hợp đồng tương lai VN30 và VN100 hầu hết đều giảm điểm trong phiên giao dịch ngày 18/08/2026. VN30-Index tiếp tục giằng co đồng thời xuất hiện mẫu hình nến High...\nVN-Index diễn biến giằng co đồng thời xuất hiện mẫu hình nến Long Upper Shadow cho thấy áp lực bán vẫn hiện hữu. Chỉ số đang test lại đường Middle của Bollinger...\nDiễn biến thị trường trở nên ảm đạm trong phiên chiều. Chỉ số chủ yếu giằng co khi áp lực bán tăng dần. Kết phiên, VN-Index tăng ở mức 4.5 điểm. HNX-Index tăng hơn...\nKết thúc phiên giao dịch ngày 17/08/2026, toàn thị trường có 116 mã tăng, 162 mã giảm và 63 mã tham chiếu. Khối ngoại tiếp tục bán ròng với tổng mức bán ròng đạt...\nCác hợp đồng tương lai VN30 và VN100 tăng giảm đan xen điểm trong phiên giao dịch ngày 17/08/2026. VN30-Index diễn biến giằng co đồng thời xuất hiện mẫu hình nến...\nVN-Index diễn biến giằng co với mẫu hình nến Doji kèm khối lượng giao dịch giảm sâu dưới mức trung bình 20 ngày phản ánh tâm lý thận trọng của nhà đầu tư. Triển...\nKết thúc phiên giao dịch ngày 14/08/2026, toàn thị trường có 27 mã tăng, 277 mã giảm và 37 mã tham chiếu. Khối ngoại tiếp tục bán ròng với tổng mức bán ròng đạt...\nVN-Index điều chỉnh trở lại và cắt xuống đường SMA 50 tuần. Chỉ số vẫn đang nằm dưới đường Middle của Bollinger Bands, đây đồng thời là vùng đáy cũ đã bị phá vỡ của...\nCác hợp đồng tương lai VN30 và VN100 hầu hết đều giảm điểm trong phiên giao dịch ngày 14/08/2026. VN30-Index tiếp tục giảm điểm phiên thứ 2 đồng thời xuất hiện mẫu...\nVietstock trân trọng thông báo đến Quý Khách hàng về việc áp dụng “Chính sách quyền riêng tư” căn cứ theo Nghị định số 13/2023/NĐ-CP v/v bảo vệ dữ liệu cá nhân được ban hành bởi Chính phủ.\nTrong quá trình thiết lập mối quan hệ giữa Vietstock và Khách hàng, Vietstock có thể thu thập và xử lý dữ liệu cá nhân của Khách hàng cho mục đích được xác định tại Chính sách quyền riêng tư (“CSQRT”) này. Trong trường hợp Khách hàng không đồng ý một phần hoặc toàn bộ quy định tại CSQRT, Vietstock không thể cung cấp sản phẩm và dịch vụ cho Khách hàng.\nVietstock cam kết luôn tôn trọng quyền riêng tư, bảo mật và an toàn thông tin cá nhân; đồng thời luôn nỗ lực bảo vệ dữ liệu cá nhân của Khách hàng, tuân thủ quy định pháp luật Việt Nam thông qua những biện pháp bảo vệ dữ liệu cá nhân đáp ứng và phù hợp với quy định pháp luật Việt Nam.\nChính sách quyền riêng tư là một phần không thể tách rời của các thỏa thuận, điều khoản và điều kiện chi phối mối quan hệ giữa Vietstock và Quý Khách hàng.\nQuý Khách hàng đã đọc kỹ, hiểu rõ và đồng ý với toàn bộ điều khoản của “Chính sách quyền riêng tư”. Chi tiết Chính sách quyền riêng tư xem tại đây.\nNếu không đồng ý với Chính sách quyền riêng tư này, Chúng tôi không thể cung cấp sản phẩm và dịch vụ cho Quý Khách hàng.",
  "extraction_quality": "high",
  "structure": {
    "headings": [
      {
        "level": 1,
        "text": "Thị trường chứng quyền ngày 19/08/2026: Sự bi quan vẫn còn"
      },
      {
        "level": 3,
        "text": "Các kênh đầu tư"
      },
      {
        "level": 4,
        "text": "Góc nhìn 19/08: Giằng co trong biên độ hẹp?"
      },
      {
        "level": 4,
        "text": "Chứng khoán phái sinh ngày 19/08/2026: Tiếp tục thận trọng?"
      },
      {
        "level": 4,
        "text": "Vietstock Daily 19/08/2026: Chưa hết rung lắc?"
      },
      {
        "level": 4,
        "text": "Nhịp đập Thị trường 18/08: Lực bán ở nhóm tài chính gia tăng"
      },
      {
        "level": 2,
        "text": "MÃ CHỨNG KHOÁN LIÊN QUAN (3)"
      },
      {
        "level": 2,
        "text": "TIN TỨC MÃ CHỨNG KHOÁN"
      },
      {
        "level": 2,
        "text": "1"
      },
      {
        "level": 4,
        "text": "Theo dấu dòng tiền cá mập 13/08: SSI được tự doanh và khối ngoại đồng thuận mua ròng mạnh"
      },
      {
        "level": 2,
        "text": "2"
      },
      {
        "level": 4,
        "text": "Chủ tịch SSI bị mạo danh trên mạng xã hội"
      },
      {
        "level": 2,
        "text": "3"
      },
      {
        "level": 4,
        "text": "HFIC chi hơn 300 tỷ thực hiện quyền mua cổ phiếu HCM"
      },
      {
        "level": 2,
        "text": "4"
      },
      {
        "level": 4,
        "text": "Chuyên gia HSC: Kết quả kinh doanh khởi sắc, dòng tiền đang chuẩn bị cho một chu kỳ mới"
      },
      {
        "level": 2,
        "text": "5"
      },
      {
        "level": 4,
        "text": "Môi giới rao bán 46 nền đất 'bao sổ riêng' ở TPHCM, phường cảnh báo"
      },
      {
        "level": 2,
        "text": "TIN CÙNG CHUYÊN MỤC"
      },
      {
        "level": 4,
        "text": "Chứng khoán phái sinh ngày 19/08/2026: Tiếp tục thận trọng?"
      },
      {
        "level": 4,
        "text": "Vietstock Daily 19/08/2026: Chưa hết rung lắc?"
      },
      {
        "level": 4,
        "text": "Nhịp đập Thị trường 18/08: Lực bán ở nhóm tài chính gia tăng"
      },
      {
        "level": 4,
        "text": "Thị trường chứng quyền ngày 18/08/2026: Sắc xanh đỏ đan xen"
      },
      {
        "level": 4,
        "text": "Chứng khoán phái sinh ngày 18/08/2026: Thanh khoản toàn thị trường sụt giảm"
      },
      {
        "level": 4,
        "text": "Vietstock Daily 18/08/2026: Giằng co trong thận trọng"
      },
      {
        "level": 4,
        "text": "Nhịp đập Thị trường 17/08: Nỗ lực lấy lại sắc xanh bất thành"
      },
      {
        "level": 4,
        "text": "Thị trường chứng quyền tuần 17-21/08/2026: Sự bi quan vẫn còn"
      },
      {
        "level": 4,
        "text": "Vietstock Weekly 17-21/08/2026: Mất đà phục hồi?"
      },
      {
        "level": 4,
        "text": "Chứng khoán phái sinh tuần 17-21/08/2026: Rủi ro ngắn hạn gia tăng"
      },
      {
        "level": 2,
        "text": "Chỉ số thị trường"
      },
      {
        "level": 2,
        "text": "TIN CHÍNH"
      },
      {
        "level": 2,
        "text": "ĐỌC NHIỀU NHẤT"
      },
      {
        "level": 4,
        "text": "Báo lỗi bài viết"
      },
      {
        "level": 3,
        "text": "Truyền Thông Tài Chính"
      },
      {
        "level": 3,
        "text": "Dữ Liệu Tài Chính"
      },
      {
        "level": 3,
        "text": "Sách tài chính"
      },
      {
        "level": 6,
        "text": "Quảng cáo & Dịch vụ"
      },
      {
        "level": 6,
        "text": "Sáng tạo nội dung"
      },
      {
        "level": 6,
        "text": "Văn phòng giao dịch"
      },
      {
        "level": 3,
        "text": "Lớp học sắp khai giảng"
      },
      {
        "level": 3,
        "text": "Sách tài chính"
      },
      {
        "level": 6,
        "text": "Quảng cáo & Dịch vụ"
      },
      {
        "level": 6,
        "text": "Sáng tạo nội dung"
      },
      {
        "level": 6,
        "text": "Văn phòng giao dịch"
      },
      {
        "level": 3,
        "text": "Sách tài chính"
      },
      {
        "level": 4,
        "text": "Tính năng (-)"
      },
      {
        "level": 4,
        "text": "Ngành (-)"
      },
      {
        "level": 4,
        "text": "Mã chứng khoán (-)"
      },
      {
        "level": 4,
        "text": "Lãnh đạo (-)"
      },
      {
        "level": 4,
        "text": "Tin tức (-)"
      },
      {
        "level": 4,
        "text": "Bài viết của tác giả (-)"
      },
      {
        "level": 4,